<?xml version="1.0"?>
<!DOCTYPE autolayout PUBLIC "-//Norman Walsh//DTD Website Autolayout V2.4.1//EN" "http://docbook.sourceforge.net/release/website/2.4.1/schema/dtd/autolayout.dtd">
<autolayout>
<style title="Blue" src="blue.css" type="text/css"/><copyright><year>1999</year><year>2000</year><year>2001</year><year>2002</year><year>2003</year><year>2004</year><holder role="http://www.bibletime.info/">Les d&#xE9;veloppeurs BibleTime - www.bibletime.info</holder></copyright><notoc page="error404.xml" id="error404" filename="error404.html">
<title>Erreur</title>
<summary>Error 404: File not found</summary>
</notoc>
<toc page="index.xml" id="index" filename="no_index.html">
<title>BibleTime</title>
<summary>Introduction</summary>
<tocentry page="software.xml" id="software" filename="index.html">
<title>Logiciel</title>
<summary>Introduction</summary>
<tocentry page="software_about.xml" id="software_about" filename="software_about.html">
<title>A propos de BibleTime</title>
<summary>Introduction to the BibleTime software</summary>
</tocentry>
<tocentry page="software_screenshots.xml" id="software_screenshots" filename="software_screenshots.html">
<title>Captures &#xE9;cran</title>
<summary>Screenshots of BibleTime</summary>
</tocentry>
<tocentry page="software_gallery.xml" id="software_gallery" filename="software_gallery.html">
<title>Gallery</title>
<summary>Gallery of BibleTime</summary>
</tocentry>
<tocentry page="software_installation.xml" id="documentation_installation_bibletime" filename="software_installation.html">
<title>T&#xE9;l&#xE9;chargement</title>
<summary>Installation to the BibleTime software</summary>
</tocentry>
<tocentry page="software_faq.xml" id="documentation_ifaq" filename="software_faq.html">
<title>FAQ</title>
<summary>FAQ about BibleTime</summary>
</tocentry>
<tocentry page="software_swordcd.xml" id="software_swordcd" filename="software_swordcd.shtml">
<title>CD Sword</title>
<summary>Get the Sword CD</summary>
</tocentry>
<tocentry page="software_links.xml" id="software_links" filename="software_links.html">
<title>Liens</title>
<summary>Link collection of good sites</summary>
</tocentry>
<tocentry page="software_linkus.xml" id="software_linkus" filename="software_linkus.html">
<title>Liens vers nous</title>
<summary>How to link to www.bibletime.info</summary>
</tocentry>
<tocentry page="software_guestbook.xml" id="software_guestbook" filename="software_guestbook.shtml">
<title>Livre d'or</title>
<summary>BibleTime's guestbook</summary>
</tocentry>
<tocentry page="software_press.xml" id="software_press" filename="software_press.html">
<title>Dans la presse</title>
<summary>BibleTime in the press</summary>
</tocentry>
<tocentry page="software_contact.xml" id="contact" filename="software_contact.html">
<title>Contact</title>
<summary>How to contact us</summary>
</tocentry>
<tocentry page="software_license.xml" id="software_license" filename="software_license.html">
<title>License</title>
<summary>BibleTime's license</summary>
</tocentry>
</tocentry>
<tocentry page="development.xml" id="development" filename="development.html">
<title>D&#xE9;veloppement</title>
<summary>BibleTime's development</summary>
<tocentry page="development_help.xml" id="development_help" filename="development_help.html">
<title>Aidez-nous</title>
<summary>BibleTime's development</summary>
</tocentry>
<tocentry page="development_join.xml" id="development_join" filename="development_join.html">
<title>Joignez-nous</title>
<summary>BibleTime's development</summary>
</tocentry>
<tocentry page="development_mailinglists.xml" id="development_mailinglists" filename="development_mailinglists.html">
<title>Forums</title>
<summary>BibleTime's mailinglists</summary>
</tocentry>
</tocentry>
<tocentry page="translation.xml" id="translation" filename="translation.shtml">
<title>Traduction</title>
<summary>Introduction</summary>
</tocentry>
<tocentry page="biblehowto.docbook" id="biblehowto" filename="biblehowto.html">
<title>HowTo d'&#xE9;tude biblique</title>
<summary>The BibleTime Biblestudy HowTo</summary>
</tocentry>
</toc>
</autolayout>

